{
  "id": "nmth-20100030001",
  "source_id": "2010.003.0001",
  "title": {
    "zh": "一心誠敬版印斗方"
  },
  "artist": {
    "zh": "不詳"
  },
  "date_text": "1895-1945（日本時代）",
  "medium": "版印",
  "dimensions": "35.2 x 51.2cm",
  "collection": "國立臺灣歷史博物館",
  "image": {
    "path": "kb/images/nmth-20100030001.jpg",
    "license": "CC BY 4.0",
    "attribution": "國立臺灣歷史博物館，CC BY 4.0",
    "source_url": "https://collections.culture.tw/Object.aspx?SYSUID=11&RNO=MjAxMC4wMDMuMDAwMQ%3D%3D"
  },
  "source_url": "https://collections.culture.tw/Object.aspx?SYSUID=11&RNO=MjAxMC4wMDMuMDAwMQ%3D%3D",
  "descriptions": [
    {
      "lang": "zh",
      "topic": "畫面與技法",
      "text": "本件一心誠敬版印斗方，在墨線圖案基礎上套印花青、石青、朱紅、洋紅等色而成，印製於米黃色紙張之上。畫面作上下高於左右的長方形，上下兩端分別為寶相花之橫條邊飾，上方花條之下在朱紅底色之上有瓶花、書函、靈芝、佛手瓜等吉祥瓶供物品。下方主畫面區分為三欄，中間一欄上方在花青底色之上作朱紅、洋紅、米黃等色文字「一心誠敬」，其下為福祿壽三仙圖，天官福仙在上，前方為壽仙與祿仙，福仙身後有童子持日月扇，三仙兩旁一對頭上尾下的飛鳳。左右兩欄分別作格扇屏垛，頂垛為琴、書與葫蘆如意紋，身垛為一對面朝中央的番人進寶圖，裙垛為螭虎吉慶圖。",
      "source_url": "https://collections.culture.tw/Object.aspx?SYSUID=11&RNO=MjAxMC4wMDMuMDAwMQ%3D%3D",
      "license": "CC BY 4.0",
      "attribution": "國立臺灣歷史博物館，CC BY 4.0"
    },
    {
      "lang": "zh",
      "topic": "用途與寓意",
      "text": "斗方為方形版印，多用於裝飾紙紮用品，如燈座、七娘媽亭、三元天宮等，以套色木版印刷而成，用以點綴喜慶氣氛，其題材相當多元。一心誠敬斗方多與叩答恩光、祈求平安等為三件一組搭配，分別張貼於三界公燈座之前方，以作為燈座之糊紙裝飾。",
      "source_url": "https://collections.culture.tw/Object.aspx?SYSUID=11&RNO=MjAxMC4wMDMuMDAwMQ%3D%3D",
      "license": "CC BY 4.0",
      "attribution": "國立臺灣歷史博物館，CC BY 4.0"
    },
    {
      "lang": "zh",
      "topic": "基本資料（依館方欄位整理）",
      "text": "一心誠敬版印斗方，國立臺灣歷史博物館藏品，登錄號 2010.003.0001。尺寸 35.2 x 51.2cm，歷史分期 1895-1945（日本時代），製造地 臺南，創作者／製造者 不詳。關鍵詞：斗方、吉慶、糊紙。參考資料：黃才郎主編，1985。臺灣傳統版畫源流特展。臺北：行政院文建會。編目者：委託編目謝宗榮（2015/12/29）。",
      "source_url": "https://collections.culture.tw/Object.aspx?SYSUID=11&RNO=MjAxMC4wMDMuMDAwMQ%3D%3D",
      "license": "CC BY 4.0",
      "attribution": "國立臺灣歷史博物館，CC BY 4.0"
    }
  ]
}
