{
  "id": "tcmb-266894",
  "source_id": "266894",
  "title": {
    "zh": "褒忠祠狄青對戰八寶公主交趾陶群偶"
  },
  "artist": {
    "zh": "陳天乞"
  },
  "date_text": "未載明",
  "medium": "交趾陶",
  "collection": "平鎮褒忠祠",
  "image": {
    "path": "kb/images/tcmb-266894.jpg",
    "license": "CC BY 4.0",
    "attribution": "班馬傳媒股份有限公司／文化部國家文化記憶庫，CC BY 3.0 TW 及其後版本",
    "source_url": "https://dcm.s3.hicloud.net.tw/new/g_upload/collection/2019-10-29/1b3c8626-59ad-4c89-88fe-500611404172/82b439a4-1388-45f7-9df7-2f85c39813a5.jpg"
  },
  "source_url": "https://tcmb.culture.tw/zh-tw/detail?indexCode=Culture_Object&id=266894",
  "descriptions": [
    {
      "lang": "zh",
      "topic": "作品",
      "text": "陳天乞位於褒忠祠代表作，一將軍騎馬追著女將，是男女相戰的故事，若不是狄青對八寶公主，就是薛丁山對樊梨花，若是移山倒海樊梨花，則會有城門寫著樊江關的背景，由系列作品可見見乞司人物雖僅為23-30公分，但形象生動靈活，極具歌仔戲碼之動感，為乞司盛年時的佳作。",
      "source_url": "https://tcmb.culture.tw/zh-tw/detail?indexCode=Culture_Object&id=266894",
      "license": "CC BY 4.0",
      "attribution": "班馬傳媒股份有限公司／文化部國家文化記憶庫，CC BY 3.0 TW 及其後版本"
    },
    {
      "lang": "zh",
      "topic": "匠師在桃園的作品",
      "text": "1956至1969 年間，是陳天乞在桃園地區活動的旺盛期，參與了許多寺廟的施作，其中有桃園景福宮、平鎮土地公廟、平鎮褒忠亭、中壢新街仁海宮、龜山壽山巖、八德三元宮、觀音新碑王公廟、觀音廖祖廟、觀音土地公廟、虎頭山三聖宮、龍潭大廟、竹圍王公廟等等，主要負責的部分都是壁堵或是屋頂的剪黏及交趾陶。其中又以平鎮褒忠祠最具代表性，其完整保存了陳天乞交趾陶作品，陳天乞在褒忠祠上的創作尤以一套完整二十四孝故事題材的作品最為特殊，也充分表現客家人講究忠孝節義的行事風格。其他作品還有以三國演義、封神榜等傳統中國演義故事為素材，作品數量豐富、質量高超，是乞司中年時代難得的優秀作品。 1973年整修。廟方還收藏陳天乞就地建窯燒製的一百六十八個交趾陶偶，因此2018-2019年陳天乞專題時曾多次拍攝與訪談廟方人員。",
      "source_url": "https://tcmb.culture.tw/zh-tw/detail?indexCode=Culture_Object&id=266894",
      "license": "CC BY 4.0",
      "attribution": "班馬傳媒股份有限公司／文化部國家文化記憶庫，CC BY 3.0 TW 及其後版本"
    },
    {
      "lang": "zh",
      "topic": "匠師資訊",
      "text": "陳天乞（1906–1990）出生於中國泉州，1990年卒於新北市三重。業界稱為「阿乞師」。大正年間（1918）隨表姊夫洪坤福來臺，於大龍峒保安宮開始學習剪花工藝。昭和初（1928）開始獨自承包工程，作品多位於南部，但戰爭爆發期間，寺廟工程多半停頓，便改作土水工程，維持家計。",
      "source_url": "https://tcmb.culture.tw/zh-tw/detail?indexCode=Culture_Object&id=266894",
      "license": "CC BY 4.0",
      "attribution": "班馬傳媒股份有限公司／文化部國家文化記憶庫，CC BY 3.0 TW 及其後版本"
    },
    {
      "lang": "zh",
      "topic": "匠師資訊",
      "text": "戰後承包的工程不斷，尤以1961年開始收徒弟後達到高峰。陳天乞最早師承泉州府同安縣交趾陶燒師傳柯訓，柯訓曾於明治四十四年（1911）來北港朝天宮參與交趾陶工程，這時他的徒弟洪坤福亦跟隨前來；到了大正七年（1918）, 洪坤福正式攜外甥陳天乞抵臺，參與臺北大龍峒保安宮的交趾陶、剪黏施作，也開啟陳天乞在臺灣的執業生涯。",
      "source_url": "https://tcmb.culture.tw/zh-tw/detail?indexCode=Culture_Object&id=266894",
      "license": "CC BY 4.0",
      "attribution": "班馬傳媒股份有限公司／文化部國家文化記憶庫，CC BY 3.0 TW 及其後版本"
    },
    {
      "lang": "zh",
      "topic": "匠師資訊",
      "text": "桃園溥濟宮、台北福景宮、淡水福佑宮等，都存留乞司的親手之作。而陳天乞繼承的留灰縫傳統技法，也讓乞司的作品除了更能耐受風雨，在多年之後，更能洗練出一種古物的韻味。",
      "source_url": "https://tcmb.culture.tw/zh-tw/detail?indexCode=Culture_Object&id=266894",
      "license": "CC BY 4.0",
      "attribution": "班馬傳媒股份有限公司／文化部國家文化記憶庫，CC BY 3.0 TW 及其後版本"
    },
    {
      "lang": "zh",
      "topic": "宮廟資訊",
      "text": "平鎮褒忠祠稱為主要供奉客家先賢于清乾隆四十八年（1783）林爽文叛變時，奮勇發揮客家剛強弘毅及傳統忠義精神平亂，所犧牲的二百多位義民。清乾隆五十三年（1788）鄉民在義民墓前興建廟宇奉祀英靈，併合祀三山護國王、觀音佛祖、福德正神等神明，還呈請乾隆皇帝御題「褒忠」清乾隆56年（1791）桃澗堡宋屋廣興庄總理宋廷龍，感佩義民軍的壯烈犧牲，從新埔枋寮褒忠亭分香，而於廣興庄創建「義民亭」，供桃園客家地區信眾參拜，以彰顯義民的忠烈。清咸豐10年（1860）由總理宋寶雲募捐增建前堂及兩廊，並勒碑為記，名「褒忠祠」。",
      "source_url": "https://tcmb.culture.tw/zh-tw/detail?indexCode=Culture_Object&id=266894",
      "license": "CC BY 4.0",
      "attribution": "班馬傳媒股份有限公司／文化部國家文化記憶庫，CC BY 3.0 TW 及其後版本"
    },
    {
      "lang": "zh",
      "topic": "基本資料（依頁面欄位整理）",
      "text": "褒忠祠狄青對戰八寶公主交趾陶群偶，材質為交趾陶，所在地：平鎮褒忠祠，匠師：陳天乞。本筆資料由班馬傳媒股份有限公司建檔，收錄於文化部國家文化記憶庫，授權為 CC BY 3.0 TW 及其後版本。",
      "source_url": "https://tcmb.culture.tw/zh-tw/detail?indexCode=Culture_Object&id=266894",
      "license": "CC BY 4.0",
      "attribution": "班馬傳媒股份有限公司／文化部國家文化記憶庫，CC BY 3.0 TW 及其後版本"
    }
  ]
}
