{
  "id": "tcmb-292510",
  "source_id": "292510",
  "title": {
    "zh": "北港朝天宮龍造型剪粘"
  },
  "artist": {
    "zh": "未載明（屋頂剪黏歷經柯訓、洪坤福、江清露、許哲彥四代匠師）"
  },
  "date_text": "未載明",
  "medium": "剪粘",
  "collection": "北港朝天宮",
  "image": {
    "path": "kb/images/tcmb-292510.jpg",
    "license": "CC BY 4.0",
    "attribution": "班馬傳媒股份有限公司／文化部國家文化記憶庫，CC BY 3.0 TW 及其後版本",
    "source_url": "https://dcm.s3.hicloud.net.tw/new/g_upload/collection/2019-11-24/608702fc-2d53-4549-bc20-f4218a4be533/23a19443-2534-41d7-b61b-ac45dd76ed1c.jpg"
  },
  "source_url": "https://tcmb.culture.tw/zh-tw/detail?indexCode=Culture_Object&id=292510",
  "descriptions": [
    {
      "lang": "zh",
      "topic": "匠師傳承與屋頂格局",
      "text": "雲林北港朝天宮屋頂經過時代改變，考驗著匠師安置剪黏的智慧。歷經柯訓、洪坤福、江清露(1914-1994)，和現年65歲的許哲彥等人四代傳承，始呈現今日中央三川殿搭配兩側龍虎門氣勢輝煌之面貌。三川殿、拜殿和正殿，同是面寬三開間，三川殿由於左右兩側有龍虎門、廂房，一字排開，使得前殿面寬達七開間，剪黏裝飾使屋頂有若翻捲著一圈色彩斑斕的海浪。",
      "source_url": "https://tcmb.culture.tw/zh-tw/detail?indexCode=Culture_Object&id=292510",
      "license": "CC BY 4.0",
      "attribution": "班馬傳媒股份有限公司／文化部國家文化記憶庫，CC BY 3.0 TW 及其後版本"
    },
    {
      "lang": "zh",
      "topic": "三川殿屋脊的蟠龍與天官",
      "text": "做為廟宇映入人們眼中的第一道立面，在剪黏裝飾上特別費心。屋脊佈滿剪黏，幾乎不留空隙。中港間脊堵上的天官矗立於中軸線，左右兩側向上彎弧的翹脊，有蟠龍碩長的身軀順勢盤據，並回頭望向天官，一來使視線回歸中心，二來在空中呈顯圓滿收弧之感；連騎在蟠龍身上持有吉祥器物的太子或是天將，也是呈現回望姿態，人、獸動態一體成形，這是剪黏匠師長期待在屋頂上整體施作才會出現的功力。",
      "source_url": "https://tcmb.culture.tw/zh-tw/detail?indexCode=Culture_Object&id=292510",
      "license": "CC BY 4.0",
      "attribution": "班馬傳媒股份有限公司／文化部國家文化記憶庫，CC BY 3.0 TW 及其後版本"
    },
    {
      "lang": "zh",
      "topic": "仙女、人物帶騎與牌頭",
      "text": "小港間翹脊的仙女亦是回身望向天官，抬手倒扣花籃散花，以及翻飛的衣裙，都是盡量佈滿屋脊橫向彎衍的空間。中港間脊堵有人物帶騎，立體突出於脊堵牆面，上下左右四處分佈，層層疊疊，十分熱鬧活潑。牌頭特別具有份量，以假山、亭景做出高度，前方擴張出二至三層的平台給群聚的人物站立。牌頭前方往外延伸的串角將屋面拓展開來。",
      "source_url": "https://tcmb.culture.tw/zh-tw/detail?indexCode=Culture_Object&id=292510",
      "license": "CC BY 4.0",
      "attribution": "班馬傳媒股份有限公司／文化部國家文化記憶庫，CC BY 3.0 TW 及其後版本"
    },
    {
      "lang": "zh",
      "topic": "拜殿與正殿的剪黏",
      "text": "在拜殿的三川脊和正殿的重簷歇山，剪黏裝飾收斂起三川殿太具份量、塑造立體、斑斕華麗與動態誇張之作法，不失熱鬧地佈滿屋脊。剪黏外觀以高彩度且具厚度的碗片層層疊加上去，使得佈滿神仙、聖獸的屋面，更是顯得繁複華麗，目眩神迷！",
      "source_url": "https://tcmb.culture.tw/zh-tw/detail?indexCode=Culture_Object&id=292510",
      "license": "CC BY 4.0",
      "attribution": "班馬傳媒股份有限公司／文化部國家文化記憶庫，CC BY 3.0 TW 及其後版本"
    },
    {
      "lang": "zh",
      "topic": "基本資料（依頁面欄位整理）",
      "text": "北港朝天宮龍造型剪粘，材質為剪粘，所在地：北港朝天宮，匠師：未載明（屋頂剪黏歷經柯訓、洪坤福、江清露、許哲彥四代匠師）。本筆資料由班馬傳媒股份有限公司建檔，收錄於文化部國家文化記憶庫，授權為 CC BY 3.0 TW 及其後版本。",
      "source_url": "https://tcmb.culture.tw/zh-tw/detail?indexCode=Culture_Object&id=292510",
      "license": "CC BY 4.0",
      "attribution": "班馬傳媒股份有限公司／文化部國家文化記憶庫，CC BY 3.0 TW 及其後版本"
    }
  ]
}
