{
  "id": "nmth-20100030008",
  "source_id": "2010.003.0008",
  "title": {
    "zh": "富貴圖版印屏垛"
  },
  "artist": {
    "zh": "不詳"
  },
  "date_text": "1895-1945（日本時代）",
  "medium": "版印",
  "dimensions": "26.5 x 9.9cm",
  "collection": "國立臺灣歷史博物館",
  "image": {
    "path": "kb/images/nmth-20100030008.jpg",
    "license": "CC BY 4.0",
    "attribution": "國立臺灣歷史博物館，CC BY 4.0",
    "source_url": "https://collections.culture.tw/Object.aspx?SYSUID=11&RNO=MjAxMC4wMDMuMDAwOA%3D%3D"
  },
  "source_url": "https://collections.culture.tw/Object.aspx?SYSUID=11&RNO=MjAxMC4wMDMuMDAwOA%3D%3D",
  "descriptions": [
    {
      "lang": "zh",
      "topic": "畫面與技法",
      "text": "本件富貴圖版印屏垛採橫幅形式，在雙色三角文的框內佈置鳳鳥、牡丹、菊花與一隻雉雞、三隻雀鳥，以之象徵富貴、雀鳥朝鳳等意。畫面正中一隻頭朝左方的鳳鳥，前方一朵盛開的牡丹，左側一隻雉雞、兩支飛翔雀鳥，皆面朝鳳鳥，鳳鳥身後有四朵菊花與一隻飛翔雀鳥。全幅以版印墨線為基礎，套印朱紅、洋紅、花青等色而成。",
      "source_url": "https://collections.culture.tw/Object.aspx?SYSUID=11&RNO=MjAxMC4wMDMuMDAwOA%3D%3D",
      "license": "CC BY 4.0",
      "attribution": "國立臺灣歷史博物館，CC BY 4.0"
    },
    {
      "lang": "zh",
      "topic": "用途與寓意",
      "text": "屏垛為長方形版印組件，多用於裝飾紙紮用品，如燈座、宮殿等。古人認為鳳鳥為鳥中之王，而牡丹為花中之王，具有富貴之吉祥意義，而雀鳥朝鳳象徵百鳥朝鳳，有地位尊貴之意。",
      "source_url": "https://collections.culture.tw/Object.aspx?SYSUID=11&RNO=MjAxMC4wMDMuMDAwOA%3D%3D",
      "license": "CC BY 4.0",
      "attribution": "國立臺灣歷史博物館，CC BY 4.0"
    },
    {
      "lang": "zh",
      "topic": "基本資料（依館方欄位整理）",
      "text": "富貴圖版印屏垛，國立臺灣歷史博物館藏品，登錄號 2010.003.0008。尺寸 26.5 x 9.9cm，歷史分期 1895-1945（日本時代），製造地 臺南，創作者／製造者 不詳。關鍵詞：屏垛、糊紙。參考資料：黃才郎主編，1985。臺灣傳統版畫源流特展。臺北：行政院文建會。編目者：委託編目謝宗榮（2015/12/29）。",
      "source_url": "https://collections.culture.tw/Object.aspx?SYSUID=11&RNO=MjAxMC4wMDMuMDAwOA%3D%3D",
      "license": "CC BY 4.0",
      "attribution": "國立臺灣歷史博物館，CC BY 4.0"
    }
  ]
}
