{
  "id": "nmth-20100030012",
  "source_id": "2010.003.0012",
  "title": {
    "zh": "團鶴版印彩紙"
  },
  "artist": {
    "zh": "不詳"
  },
  "date_text": "1895-1945（日本時代）",
  "medium": "版印",
  "dimensions": "9.7 x 9.8cm",
  "collection": "國立臺灣歷史博物館",
  "image": {
    "path": "kb/images/nmth-20100030012.jpg",
    "license": "CC BY 4.0",
    "attribution": "國立臺灣歷史博物館，CC BY 4.0",
    "source_url": "https://collections.culture.tw/Object.aspx?SYSUID=11&RNO=MjAxMC4wMDMuMDAxMg%3D%3D"
  },
  "source_url": "https://collections.culture.tw/Object.aspx?SYSUID=11&RNO=MjAxMC4wMDMuMDAxMg%3D%3D",
  "descriptions": [
    {
      "lang": "zh",
      "topic": "畫面與技法",
      "text": "本件團鶴版印彩紙主要運用於糊紙作品的裝飾，全幅以墨線為基礎，套印花青、朱紅、洋紅、米黃等色，構圖作正圓形，將一隻蜷曲的展翅丹頂鶴置於中間，周邊圍繞八朵、四色如意頭雲朵，鶴的腳下踩一株雙頭靈芝草。",
      "source_url": "https://collections.culture.tw/Object.aspx?SYSUID=11&RNO=MjAxMC4wMDMuMDAxMg%3D%3D",
      "license": "CC BY 4.0",
      "attribution": "國立臺灣歷史博物館，CC BY 4.0"
    },
    {
      "lang": "zh",
      "topic": "用途與寓意",
      "text": "彩紙主要做為紙糊作品的組件，昔日糊紙司傅在製作糊紙品時，為了使作品呈現出吉慶的熱鬧氣氛，多採購由版畫作坊所印製的彩紙組件來加以裝飾，晚近已被現代式印刷成品所取代。仙鶴一向為受喜好的傳統吉慶題材，具有長壽的象徵與慶賀之諧音，而團鶴又有團圓、圓滿之寓意。",
      "source_url": "https://collections.culture.tw/Object.aspx?SYSUID=11&RNO=MjAxMC4wMDMuMDAxMg%3D%3D",
      "license": "CC BY 4.0",
      "attribution": "國立臺灣歷史博物館，CC BY 4.0"
    },
    {
      "lang": "zh",
      "topic": "基本資料（依館方欄位整理）",
      "text": "團鶴版印彩紙，國立臺灣歷史博物館藏品，登錄號 2010.003.0012。尺寸 9.7 x 9.8cm，歷史分期 1895-1945（日本時代），製造地 臺南，創作者／製造者 不詳。關鍵詞：紙糊、彩紙。參考資料：黃才郎主編，1985。臺灣傳統版畫源流特展。臺北：行政院文建會。編目者：委託編目謝宗榮（2015/12/29）。",
      "source_url": "https://collections.culture.tw/Object.aspx?SYSUID=11&RNO=MjAxMC4wMDMuMDAxMg%3D%3D",
      "license": "CC BY 4.0",
      "attribution": "國立臺灣歷史博物館，CC BY 4.0"
    }
  ]
}
