{
  "id": "tcmb-300491",
  "source_id": "300491",
  "title": {
    "zh": "葉王水車堵交趾陶：韓愈過秦嶺"
  },
  "artist": {
    "zh": "葉王"
  },
  "date_text": "未載明",
  "medium": "交趾陶",
  "collection": "震興宮",
  "image": {
    "path": "kb/images/tcmb-300491.jpg",
    "license": "CC BY 4.0",
    "attribution": "班馬傳媒股份有限公司／文化部國家文化記憶庫，CC BY 3.0 TW 及其後版本",
    "source_url": "https://dcm.s3.hicloud.net.tw/new/h_upload/collection/2019-12-02/29a1f499-c488-433b-a0e5-57ce089663f3/1b3564e0-0c4b-4d2a-9ff8-268e02793240.jpg"
  },
  "source_url": "https://tcmb.culture.tw/zh-tw/detail?indexCode=Culture_Object&id=300491",
  "descriptions": [
    {
      "lang": "zh",
      "topic": "作品",
      "text": "葉王震興宮水車堵作品：韓愈過秦嶺\n此作品於廟前虎門邊之「戇番夯廟角」作品上方水車堵，與「老子出關」相對。右起後面兩位人物著裝平淡，跟在騎馬者後面，一人挑擔、一人撐傘，應當是前方騎馬者之侍者。前方第一位人物身材短小、懸於空中，第二位人物乘坐馬上、身著袍服、手持長杖。騎馬者與懸空者分別對應韓愈與其侄孫韓湘子。",
      "source_url": "https://tcmb.culture.tw/zh-tw/detail?indexCode=Culture_Object&id=300491",
      "license": "CC BY 4.0",
      "attribution": "班馬傳媒股份有限公司／文化部國家文化記憶庫，CC BY 3.0 TW 及其後版本"
    },
    {
      "lang": "zh",
      "topic": "交趾陶在臺灣",
      "text": "交趾陶來台三百多年間，大都由唐山師傅主導製作，奠定了台灣交趾陶工藝的基礎；而台灣本土交趾陶藝師最早有紀錄的，是清朝中後期的葉王。",
      "source_url": "https://tcmb.culture.tw/zh-tw/detail?indexCode=Culture_Object&id=300491",
      "license": "CC BY 4.0",
      "attribution": "班馬傳媒股份有限公司／文化部國家文化記憶庫，CC BY 3.0 TW 及其後版本"
    },
    {
      "lang": "zh",
      "topic": "匠師資訊",
      "text": "葉王本名葉麟趾，原籍福建漳州平和，清道光6年（1826-1887年）出生於嘉義民雄。作品屬名為葉王，後世尊稱為王師。葉王的作品在人物形體的拿捏上，既寫實又能充分表現生命感；呈現吉祥走獸時，威勢生動不失詼諧，表現花鳥博古的主題時，更展現精緻的文化內涵。1930年，於台南所舉辦的「台灣文化三百年紀念會」中，日本人尾崎秀真在專題「清朝時代的台灣文化」演講中，就曾稱呼葉王為台灣交趾燒名師；1931年的《台灣日日新報》所報導「台灣の寶島たる『葉王』作の陶瓷品」，也以「非常珍貴之人才」來描述葉王，文中並提到了「嘉義交趾」之名，使台灣的交趾陶得到更多人的注目。",
      "source_url": "https://tcmb.culture.tw/zh-tw/detail?indexCode=Culture_Object&id=300491",
      "license": "CC BY 4.0",
      "attribution": "班馬傳媒股份有限公司／文化部國家文化記憶庫，CC BY 3.0 TW 及其後版本"
    },
    {
      "lang": "zh",
      "topic": "基本資料（依頁面欄位整理）",
      "text": "葉王水車堵交趾陶：韓愈過秦嶺，材質為交趾陶，所在地：震興宮，匠師：葉王。本筆資料由班馬傳媒股份有限公司建檔，收錄於文化部國家文化記憶庫，授權為 CC BY 3.0 TW 及其後版本。",
      "source_url": "https://tcmb.culture.tw/zh-tw/detail?indexCode=Culture_Object&id=300491",
      "license": "CC BY 4.0",
      "attribution": "班馬傳媒股份有限公司／文化部國家文化記憶庫，CC BY 3.0 TW 及其後版本"
    }
  ]
}
