{
  "id": "nmth-20030080677",
  "source_id": "2003.008.0677",
  "title": {
    "zh": "北港朝天宮天上聖母版印神禡"
  },
  "artist": {
    "zh": "不詳"
  },
  "date_text": "1945-（二戰後）",
  "medium": "版印",
  "dimensions": "25.5 x 36cm",
  "collection": "國立臺灣歷史博物館",
  "image": {
    "path": "kb/images/nmth-20030080677.jpg",
    "license": "CC BY 4.0",
    "attribution": "國立臺灣歷史博物館，CC BY 4.0",
    "source_url": "https://collections.culture.tw/Object.aspx?SYSUID=11&RNO=MjAwMy4wMDguMDY3Nw%3D%3D"
  },
  "source_url": "https://collections.culture.tw/Object.aspx?SYSUID=11&RNO=MjAwMy4wMDguMDY3Nw%3D%3D",
  "descriptions": [
    {
      "lang": "zh",
      "topic": "畫面與技法",
      "text": "本件北港朝天宮版印神禡，以墨版印製於紅色紙張之上。頁面邊緣有粗線方框，框內上方作傳統閩南式寺廟屋頂紋樣，屋頂前一方橫額書「北港朝天宮」，簷下左右兩側分列一根龍柱，兩柱之間作坐姿媽祖神像，兩側隨侍持搖扇之宮娥一對。媽祖像下方中央一只薰爐，兩旁分立赤足、分持鉞、槍之千里眼、順風耳二將軍。",
      "source_url": "https://collections.culture.tw/Object.aspx?SYSUID=11&RNO=MjAwMy4wMDguMDY3Nw%3D%3D",
      "license": "CC BY 4.0",
      "attribution": "國立臺灣歷史博物館，CC BY 4.0"
    },
    {
      "lang": "zh",
      "topic": "用途與寓意",
      "text": "神禡即印製神祇畫像的符令，俗稱大符，具有供奉神祇、鎮守之意。北港朝天宮為臺灣中部最著名的媽祖廟，其分靈廟宇遍佈全臺，每年陰曆新正至三月媽祖聖誕期間，各地前來進香的宮廟絡繹不絕，較為知名的如彰化南瑤宮、臺北松山慈祐宮、苗栗白沙屯拱天宮等。其次，朝天宮每年三月十九、二十所舉行的迎媽祖繞境活動，也為臺灣著名的信仰盛事。",
      "source_url": "https://collections.culture.tw/Object.aspx?SYSUID=11&RNO=MjAwMy4wMDguMDY3Nw%3D%3D",
      "license": "CC BY 4.0",
      "attribution": "國立臺灣歷史博物館，CC BY 4.0"
    },
    {
      "lang": "zh",
      "topic": "基本資料（依館方欄位整理）",
      "text": "北港朝天宮天上聖母版印神禡，國立臺灣歷史博物館藏品，登錄號 2003.008.0677。尺寸 25.5 x 36cm，歷史分期 1945-（二戰後），製造地 雲林北港，創作者／製造者 不詳。關鍵詞：神禡、大符、雲林、北港朝天宮、媽祖。參考資料：謝宗榮，2003。臺灣傳統宗教藝術。臺中：晨星出版公司。編目者：委託編目謝宗榮（2015/09/24）。",
      "source_url": "https://collections.culture.tw/Object.aspx?SYSUID=11&RNO=MjAwMy4wMDguMDY3Nw%3D%3D",
      "license": "CC BY 4.0",
      "attribution": "國立臺灣歷史博物館，CC BY 4.0"
    }
  ]
}
