{
  "id": "nmth-20030080150",
  "source_id": "2003.008.0150",
  "title": {
    "zh": "山水版印花條"
  },
  "artist": {
    "zh": "不詳"
  },
  "date_text": "1895-1945（日本時代）",
  "medium": "版印",
  "dimensions": "51.5 x 6.8cm",
  "collection": "國立臺灣歷史博物館",
  "image": {
    "path": "kb/images/nmth-20030080150.jpg",
    "license": "CC BY 4.0",
    "attribution": "國立臺灣歷史博物館，CC BY 4.0",
    "source_url": "https://collections.culture.tw/Object.aspx?SYSUID=11&RNO=MjAwMy4wMDguMDE1MA%3D%3D"
  },
  "source_url": "https://collections.culture.tw/Object.aspx?SYSUID=11&RNO=MjAwMy4wMDguMDE1MA%3D%3D",
  "descriptions": [
    {
      "lang": "zh",
      "topic": "畫面與技法",
      "text": "本件花卉版印花條為橫式構圖，全幅以橫卷軸面形式展開，畫面分別印有山峰、樹木、房屋、寶塔、漁舟、人物等，描寫漁、樵、耕、讀等農業社會生活景象，畫中人物由左至右為：樵夫、書生及書童、釣叟、漁夫、渡船，主體紋樣以墨色、花青、石綠、朱紅等色套印而成，具有傳統青綠派山水畫的風格。",
      "source_url": "https://collections.culture.tw/Object.aspx?SYSUID=11&RNO=MjAwMy4wMDguMDE1MA%3D%3D",
      "license": "CC BY 4.0",
      "attribution": "國立臺灣歷史博物館，CC BY 4.0"
    },
    {
      "lang": "zh",
      "topic": "用途與寓意",
      "text": "版印花條多做為糊紙的配件，用於屋宇類之裝飾，如靈厝、神祇宮殿等。山水為中國古代文人畫的重要題材，漁、樵、耕、讀則是古代農業社會的四種職業，也是民間的基本生活方式。山水與漁、樵、耕、讀常成為古代畫家的繪畫主題，以之象徵隱逸以及田園生活之恬淡境界。",
      "source_url": "https://collections.culture.tw/Object.aspx?SYSUID=11&RNO=MjAwMy4wMDguMDE1MA%3D%3D",
      "license": "CC BY 4.0",
      "attribution": "國立臺灣歷史博物館，CC BY 4.0"
    },
    {
      "lang": "zh",
      "topic": "基本資料（依館方欄位整理）",
      "text": "山水版印花條，國立臺灣歷史博物館藏品，登錄號 2003.008.0150。尺寸 51.5 x 6.8cm，歷史分期 1895-1945（日本時代），製造地 不詳，創作者／製造者 不詳。關鍵詞：花條、山水、糊紙、版畫。參考資料：黃才郎主編，1985。臺灣傳統版畫源流特展。臺北：行政院文建會。編目者：委託編目謝宗榮（2015/08/07）。",
      "source_url": "https://collections.culture.tw/Object.aspx?SYSUID=11&RNO=MjAwMy4wMDguMDE1MA%3D%3D",
      "license": "CC BY 4.0",
      "attribution": "國立臺灣歷史博物館，CC BY 4.0"
    }
  ]
}
