{
  "id": "nmth-20030080171",
  "source_id": "2003.008.0171",
  "title": {
    "zh": "花紙版印屏垛"
  },
  "artist": {
    "zh": "不詳"
  },
  "date_text": "1895-1945（日本時代）",
  "medium": "版印",
  "dimensions": "20 x 29.4cm",
  "collection": "國立臺灣歷史博物館",
  "image": {
    "path": "kb/images/nmth-20030080171.jpg",
    "license": "CC BY 4.0",
    "attribution": "國立臺灣歷史博物館，CC BY 4.0",
    "source_url": "https://collections.culture.tw/Object.aspx?SYSUID=11&RNO=MjAwMy4wMDguMDE3MQ%3D%3D"
  },
  "source_url": "https://collections.culture.tw/Object.aspx?SYSUID=11&RNO=MjAwMy4wMDguMDE3MQ%3D%3D",
  "descriptions": [
    {
      "lang": "zh",
      "topic": "畫面與技法",
      "text": "本件花紙版印屏垛採左右較寬的橫幅形式，在粉綠色底紙上以朱紅色、白色交錯套印花卉與器物。紋樣由上至下分為五排，最上方與最下方一排為琴、棋、書、畫、扇、犀角、葫蘆、如意等雜八寶；正中一排為兩個壽字與蓮花、牡丹；第三、第五兩排為牡丹、蓮花等。紋樣在規則的劃分之下又有局部變化。",
      "source_url": "https://collections.culture.tw/Object.aspx?SYSUID=11&RNO=MjAwMy4wMDguMDE3MQ%3D%3D",
      "license": "CC BY 4.0",
      "attribution": "國立臺灣歷史博物館，CC BY 4.0"
    },
    {
      "lang": "zh",
      "topic": "用途與寓意",
      "text": "屏垛為長方形版印組件，多用於裝飾紙紮用品，題材有人物、動物、花卉等。花紙屏垛為糊紙組件之一，一般做為大面積的裝飾，常見於靈厝、宮殿等紙紮屋宇之牆面，其構圖多採有規則變化的四方連續圖案方式配置，間或有不規則圖案者。其紋樣題材多元，主要有器物、花卉、文字等，以及純粹由線條、顏色所組成者，裝飾趣味濃厚。",
      "source_url": "https://collections.culture.tw/Object.aspx?SYSUID=11&RNO=MjAwMy4wMDguMDE3MQ%3D%3D",
      "license": "CC BY 4.0",
      "attribution": "國立臺灣歷史博物館，CC BY 4.0"
    },
    {
      "lang": "zh",
      "topic": "基本資料（依館方欄位整理）",
      "text": "花紙版印屏垛，國立臺灣歷史博物館藏品，登錄號 2003.008.0171。尺寸 20 x 29.4cm，歷史分期 1895-1945（日本時代），製造地 不詳，創作者／製造者 不詳。關鍵詞：屏垛、糊紙。參考資料：黃才郎主編，1985。臺灣傳統版畫源流特展。臺北：行政院文建會。編目者：委託編目謝宗榮（2015/09/21）。",
      "source_url": "https://collections.culture.tw/Object.aspx?SYSUID=11&RNO=MjAwMy4wMDguMDE3MQ%3D%3D",
      "license": "CC BY 4.0",
      "attribution": "國立臺灣歷史博物館，CC BY 4.0"
    }
  ]
}
