{
  "id": "met-436535",
  "source_id": "1993.132",
  "title": { "zh": "有絲柏的麥田", "en": "Wheat Field with Cypresses" },
  "artist": { "zh": "文森．梵谷", "en": "Vincent van Gogh" },
  "date_text": "1889 年",
  "medium": "油彩、畫布",
  "dimensions": "73.2 × 93.4 公分",
  "collection": "大都會藝術博物館（The Met）",
  "image": {
    "path": "kb/images/met-436535.jpg",
    "license": "CC0",
    "source_url": "https://www.metmuseum.org/art/collection/search/436535"
  },
  "source_url": "https://www.metmuseum.org/art/collection/search/436535",
  "descriptions": [
    {
      "lang": "zh",
      "topic": "畫面",
      "text": "畫面前景是一片在夏日陽光下泛著金黃色的麥田，麥穗隨風起伏。右側矗立著一株高大的深綠色絲柏，像火焰一樣向上扭動；中景有橄欖樹與灌木叢，遠方是藍紫色的阿爾皮耶山丘（Alpilles），天空中翻捲著白色與淡綠色的漩渦狀雲朵。",
      "source_url": "https://www.metmuseum.org/art/collection/search/436535",
      "license": "CC0"
    },
    {
      "lang": "zh",
      "topic": "創作背景",
      "text": "1889 年 5 月，梵谷自願住進法國南部聖雷米（Saint-Rémy-de-Provence）附近的聖保羅療養院。他在療養院周圍的田野寫生，對當地的絲柏產生濃厚興趣。這幅畫繪於 1889 年 7 月初，是在戶外現場完成的，梵谷認為它是自己最好的夏季作品之一。",
      "source_url": "https://www.metmuseum.org/art/collection/search/436535",
      "license": "CC0"
    },
    {
      "lang": "zh",
      "topic": "其他版本",
      "text": "同年 9 月，梵谷在療養院的畫室裡以這幅畫為本，又畫了一幅尺寸相近的版本，現藏倫敦國家美術館；另外還有一幅尺寸較小的版本，是畫給母親與妹妹的。",
      "source_url": "https://www.metmuseum.org/art/collection/search/436535",
      "license": "CC0"
    },
    {
      "lang": "zh",
      "topic": "技法與絲柏",
      "text": "梵谷用厚塗法（impasto）堆疊顏料，筆觸短而有節奏，讓麥田、樹木與雲朵都呈現流動的曲線。他在寫給弟弟西奧的信中形容，絲柏的線條與比例像埃及方尖碑一樣美，並說還沒有人用他看到的方式畫過絲柏。",
      "source_url": "https://www.metmuseum.org/art/collection/search/436535",
      "license": "CC0"
    },
    {
      "lang": "zh",
      "topic": "收藏",
      "text": "大都會藝術博物館在 1993 年以安納伯格基金會（The Annenberg Foundation）的捐款購得這幅畫，目前在紐約展出。",
      "source_url": "https://www.metmuseum.org/art/collection/search/436535",
      "license": "CC0"
    }
  ],
  "style_tags": ["後印象派", "油畫", "風景", "厚塗", "聖雷米時期"]
}
