{
  "id": "nmth-20100030002",
  "source_id": "2010.003.0002",
  "title": {
    "zh": "三仙版印屏垛"
  },
  "artist": {
    "zh": "不詳"
  },
  "date_text": "1895-1945（日本時代）",
  "medium": "版印",
  "dimensions": "26.2 x 20.2cm",
  "collection": "國立臺灣歷史博物館",
  "image": {
    "path": "kb/images/nmth-20100030002.jpg",
    "license": "CC BY 4.0",
    "attribution": "國立臺灣歷史博物館，CC BY 4.0",
    "source_url": "https://collections.culture.tw/Object.aspx?SYSUID=11&RNO=MjAxMC4wMDMuMDAwMg%3D%3D"
  },
  "source_url": "https://collections.culture.tw/Object.aspx?SYSUID=11&RNO=MjAxMC4wMDMuMDAwMg%3D%3D",
  "descriptions": [
    {
      "lang": "zh",
      "topic": "畫面與技法",
      "text": "本件三仙版印屏垛用於裝飾紙糊作品，採左右寬於上下的長方形畫幅，畫面主體人物為福祿壽三仙，以福仙居中，祿仙居右、壽仙居左。福仙作賜福天官公侯裝束，頭戴相帽，左手持如意，右手捋鬚，身後立一名持日月扇之宮娥；祿仙作文官裝束，手中懷抱一名孩童；壽仙作禿頂白髯老人相貌，右手拄柺杖，左手托一顆蟠桃；福仙身前一名跨騎在鹿背上的童子，童子頭戴太子冠，身穿官福，雙手捧一頂官帽，寓意加冠晉祿。畫面外框四角分別有蝴蝶寓意賜福，全幅紋樣以墨色線條為主，套印大紅、洋紅、石綠等色。",
      "source_url": "https://collections.culture.tw/Object.aspx?SYSUID=11&RNO=MjAxMC4wMDMuMDAwMg%3D%3D",
      "license": "CC BY 4.0",
      "attribution": "國立臺灣歷史博物館，CC BY 4.0"
    },
    {
      "lang": "zh",
      "topic": "用途與寓意",
      "text": "福祿壽三仙是普遍的傳統神仙人物題材，多用於祝壽紋飾。民間習以天官為文財神、祿仙送子、壽仙獻壽，故又稱「財子壽」，常見於糊紙作品、金紙、刺繡、家具、寺廟等裝飾題材，舉具有濃厚之吉慶意義。",
      "source_url": "https://collections.culture.tw/Object.aspx?SYSUID=11&RNO=MjAxMC4wMDMuMDAwMg%3D%3D",
      "license": "CC BY 4.0",
      "attribution": "國立臺灣歷史博物館，CC BY 4.0"
    },
    {
      "lang": "zh",
      "topic": "基本資料（依館方欄位整理）",
      "text": "三仙版印屏垛，國立臺灣歷史博物館藏品，登錄號 2010.003.0002。尺寸 26.2 x 20.2cm，歷史分期 1895-1945（日本時代），製造地 臺南，創作者／製造者 不詳。關鍵詞：吉慶、糊紙、福祿壽、財子壽。參考資料：黃才郎主編，1985。臺灣傳統版畫源流特展。臺北：行政院文建會。編目者：委託編目謝宗榮（2015/12/29）。",
      "source_url": "https://collections.culture.tw/Object.aspx?SYSUID=11&RNO=MjAxMC4wMDMuMDAwMg%3D%3D",
      "license": "CC BY 4.0",
      "attribution": "國立臺灣歷史博物館，CC BY 4.0"
    }
  ]
}
