{
  "id": "nmth-20100030009",
  "source_id": "2010.003.0009",
  "title": {
    "zh": "八仙版印彩紙"
  },
  "artist": {
    "zh": "不詳"
  },
  "date_text": "1895-1945（日本時代）",
  "medium": "版印",
  "dimensions": "30.2 x 10.3cm",
  "collection": "國立臺灣歷史博物館",
  "image": {
    "path": "kb/images/nmth-20100030009.jpg",
    "license": "CC BY 4.0",
    "attribution": "國立臺灣歷史博物館，CC BY 4.0",
    "source_url": "https://collections.culture.tw/Object.aspx?SYSUID=11&RNO=MjAxMC4wMDMuMDAwOQ%3D%3D"
  },
  "source_url": "https://collections.culture.tw/Object.aspx?SYSUID=11&RNO=MjAxMC4wMDMuMDAwOQ%3D%3D",
  "descriptions": [
    {
      "lang": "zh",
      "topic": "畫面與技法",
      "text": "本件八仙版印彩紙為整組八仙人物中的四位，以墨線為基礎，在白色紙張上套印朱紅、洋紅、花青、米黃等色而成。畫面中的人物由左至右為李鐵拐騎虎、漢鍾離騎豹、呂洞賓騎獅、曹國舅騎象，圖像之線條簡單而姿態生動。本組八仙版印彩紙用於製作紙糊燈座之配件，製作時將印製完成之八仙依照每一位神仙之外形裁下，然後依序以漿糊黏貼於燈座之上。",
      "source_url": "https://collections.culture.tw/Object.aspx?SYSUID=11&RNO=MjAxMC4wMDMuMDAwOQ%3D%3D",
      "license": "CC BY 4.0",
      "attribution": "國立臺灣歷史博物館，CC BY 4.0"
    },
    {
      "lang": "zh",
      "topic": "用途與寓意",
      "text": "八仙為常見的神仙人物題材，一般為九名一組，以南極仙翁為八仙頭，其次有李鐵拐、漢鍾離、呂洞賓、張果老、曹國舅、何仙姑、韓湘子、藍采和等，有時也以劉海取代藍采和，常做為祝壽、祝賀新婚、新居落成等之吉慶題材，多見於八仙彩與寺廟裝飾。",
      "source_url": "https://collections.culture.tw/Object.aspx?SYSUID=11&RNO=MjAxMC4wMDMuMDAwOQ%3D%3D",
      "license": "CC BY 4.0",
      "attribution": "國立臺灣歷史博物館，CC BY 4.0"
    },
    {
      "lang": "zh",
      "topic": "基本資料（依館方欄位整理）",
      "text": "八仙版印彩紙，國立臺灣歷史博物館藏品，登錄號 2010.003.0009。尺寸 30.2 x 10.3cm，歷史分期 1895-1945（日本時代），製造地 臺南，創作者／製造者 不詳。關鍵詞：八仙、彩紙。參考資料：黃才郎主編，1985。臺灣傳統版畫源流特展。臺北：行政院文建會。編目者：委託編目謝宗榮（2015/12/29）。",
      "source_url": "https://collections.culture.tw/Object.aspx?SYSUID=11&RNO=MjAxMC4wMDMuMDAwOQ%3D%3D",
      "license": "CC BY 4.0",
      "attribution": "國立臺灣歷史博物館，CC BY 4.0"
    }
  ]
}
