{
  "id": "nmth-20030080137",
  "source_id": "2003.008.0137",
  "title": {
    "zh": "貢寶圖版印屏垛"
  },
  "artist": {
    "zh": "不詳"
  },
  "date_text": "1895-1945（日本時代）",
  "medium": "版印",
  "dimensions": "16 x 35.5cm",
  "collection": "國立臺灣歷史博物館",
  "image": {
    "path": "kb/images/nmth-20030080137.jpg",
    "license": "CC BY 4.0",
    "attribution": "國立臺灣歷史博物館，CC BY 4.0",
    "source_url": "https://collections.culture.tw/Object.aspx?SYSUID=11&RNO=MjAwMy4wMDguMDEzNw%3D%3D"
  },
  "source_url": "https://collections.culture.tw/Object.aspx?SYSUID=11&RNO=MjAwMy4wMDguMDEzNw%3D%3D",
  "descriptions": [
    {
      "lang": "zh",
      "topic": "畫面與技法",
      "text": "本件貢寶圖畫面採傳統建築格扇屏造形，構圖區分為左右兩面對稱，兩面由上而下又同樣區分為頂垛、身垛與群垛三個部份，頂垛紋飾右面為書冊與畫卷，左面為葫蘆與靈芝。群垛左右兩面皆作「螭虎團爐」，由兩條頭部朝上的螭虎圍繞成一只香爐。身垛為屏垛之焦點，左右分別作一名胡人進貢圖像，右面胡人手持一只盆，盆中有寶珠與元寶，左面胡人持一只花瓶，瓶中插有芭蕉葉與靈芝，兩兩相對作獻寶狀。",
      "source_url": "https://collections.culture.tw/Object.aspx?SYSUID=11&RNO=MjAwMy4wMDguMDEzNw%3D%3D",
      "license": "CC BY 4.0",
      "attribution": "國立臺灣歷史博物館，CC BY 4.0"
    },
    {
      "lang": "zh",
      "topic": "用途與寓意",
      "text": "版印屏垛之題材相當多元，多用於裝飾紙紮用品，如燈座、七娘媽亭、神祇宮殿等，以套色木版印刷而成，用以點綴喜慶氣氛。長形直幅的屏垛多用於裝飾宮殿屋宇。貢寶圖多作四夷進獻財寶來朝貢內容，具有國富民強之吉慶寓意。",
      "source_url": "https://collections.culture.tw/Object.aspx?SYSUID=11&RNO=MjAwMy4wMDguMDEzNw%3D%3D",
      "license": "CC BY 4.0",
      "attribution": "國立臺灣歷史博物館，CC BY 4.0"
    },
    {
      "lang": "zh",
      "topic": "基本資料（依館方欄位整理）",
      "text": "貢寶圖版印屏垛，國立臺灣歷史博物館藏品，登錄號 2003.008.0137。尺寸 16 x 35.5cm，歷史分期 1895-1945（日本時代），製造地 不詳，創作者／製造者 不詳。關鍵詞：屏垛、吉慶、糊紙、版畫。參考資料：黃才郎主編，1985。臺灣傳統版畫源流特展。臺北：行政院文建會。編目者：委託編目謝宗榮（2015/08/07）。",
      "source_url": "https://collections.culture.tw/Object.aspx?SYSUID=11&RNO=MjAwMy4wMDguMDEzNw%3D%3D",
      "license": "CC BY 4.0",
      "attribution": "國立臺灣歷史博物館，CC BY 4.0"
    }
  ]
}
