{
  "id": "tcmb-300485",
  "source_id": "300485",
  "title": {
    "zh": "王保原剪粘西施入吳宮"
  },
  "artist": {
    "zh": "王保原"
  },
  "date_text": "未載明",
  "medium": "剪粘",
  "collection": "未載明所在宮廟",
  "image": {
    "path": "kb/images/tcmb-300485.jpg",
    "license": "CC BY 4.0",
    "attribution": "班馬傳媒股份有限公司／文化部國家文化記憶庫，CC BY 3.0 TW 及其後版本",
    "source_url": "https://dcm.s3.hicloud.net.tw/new/h_upload/collection/2019-12-02/5001f6e0-4ca5-43b8-9d86-f8fccad80b98/6ec1b001-fc75-4299-9bd6-6fd60ed9d2bd.jpg"
  },
  "source_url": "https://tcmb.culture.tw/zh-tw/detail?indexCode=Culture_Object&id=300485",
  "descriptions": [
    {
      "lang": "zh",
      "topic": "作品",
      "text": "此作品於龍門外，「博古通今」旁。第一排左起頭戴冕冠、長髥朱袍者為吳王夫差，一旁著綠色正裝、向吳王進言貌者為范蠡，他們旁邊別過面、著官服之老者為伍子胥，意味著被吳王疏遠。第二排左起著青衣之女子為鄭旦，與之相對、侍立在吳王前之綠衣女子為西施，著朱色官服、面向吳王者為伯嚭，朱色戎裝之吳國將軍守在堂外，為王保原仿葉王的作品。",
      "source_url": "https://tcmb.culture.tw/zh-tw/detail?indexCode=Culture_Object&id=300485",
      "license": "CC BY 4.0",
      "attribution": "班馬傳媒股份有限公司／文化部國家文化記憶庫，CC BY 3.0 TW 及其後版本"
    },
    {
      "lang": "zh",
      "topic": "交趾陶在臺灣",
      "text": "交趾陶來台三百多年間，大都由唐山師傅主導製作，奠定了台灣交趾陶工藝的基礎；而台灣本土交趾陶藝師最早有紀錄的，是清朝中後期的葉王。",
      "source_url": "https://tcmb.culture.tw/zh-tw/detail?indexCode=Culture_Object&id=300485",
      "license": "CC BY 4.0",
      "attribution": "班馬傳媒股份有限公司／文化部國家文化記憶庫，CC BY 3.0 TW 及其後版本"
    },
    {
      "lang": "zh",
      "topic": "葉王（本件所仿效的匠師）",
      "text": "葉王本名葉麟趾，原籍福建漳州平和，清道光6年（1826-1887年）出生於嘉義民雄。作品屬名為葉王，後世尊稱為王師。葉王的作品在人物形體的拿捏上，既寫實又能充分表現生命感；呈現吉祥走獸時，威勢生動不失詼諧，表現花鳥博古的主題時，更展現精緻的文化內涵。1930年，於台南所舉辦的「台灣文化三百年紀念會」中，日本人尾崎秀真在專題「清朝時代的台灣文化」演講中，就曾稱呼葉王為台灣交趾燒名師；1931年的《台灣日日新報》所報導「台灣の寶島たる『葉王』作の陶瓷品」，也以「非常珍貴之人才」來描述葉王，文中並提到了「嘉義交趾」之名，使台灣的交趾陶得到更多人的注目。",
      "source_url": "https://tcmb.culture.tw/zh-tw/detail?indexCode=Culture_Object&id=300485",
      "license": "CC BY 4.0",
      "attribution": "班馬傳媒股份有限公司／文化部國家文化記憶庫，CC BY 3.0 TW 及其後版本"
    },
    {
      "lang": "zh",
      "topic": "基本資料（依頁面欄位整理）",
      "text": "王保原剪粘西施入吳宮，材質為剪粘，所在地：未載明所在宮廟，匠師：王保原。本筆資料由班馬傳媒股份有限公司建檔，收錄於文化部國家文化記憶庫，授權為 CC BY 3.0 TW 及其後版本。",
      "source_url": "https://tcmb.culture.tw/zh-tw/detail?indexCode=Culture_Object&id=300485",
      "license": "CC BY 4.0",
      "attribution": "班馬傳媒股份有限公司／文化部國家文化記憶庫，CC BY 3.0 TW 及其後版本"
    }
  ]
}
